,title,company,location,indeed_url,page_number,app_type,app_text,company_url,rank_on_page,description,stats.gender,stats.pronoun,stats.female,stats.veteran,stats.race,stats.nonbinary,stats.non-binary,stats.cisgender,stats.transgender,stats.diversity
0,Fullstack or Back-end or UX Engineering Intern,Inspirave,"New York, NY",http://indeed.com//pagead/clk?mo=r&ad=-6NYlbfkN0CQX70nsyY4fdsCOngI4EcKm6bzgiJvnPRADDTsAHBnDGFP7JOf-vyziHD6W5Xp-nQLTb8AvBvVgNUKDtPhL9_mmZcfmJBUB0NKrSJ-Al_JBnYJPvIls38g8JpFRdOZ46L7wHFLACNhRNy6CgORcbquMw6vpihq-mbDaYF4-ugvurv-G5-WgsXxvCTxXpj8WxdtsNn1A8S39-slKz45Jdwn9FTi5aPvPuLdJGXtR7KLuZClWXL0v1AnKbRPeysaldt6Jb1svInc3hr8pji5wEmkF1DHAhhzG_wTZwRDERTUTnRvkt7wzNnX7_b30h4adjEoDczmg5AMwP1Qn4xCyE027cm2wUdyXBnLsAbHp1_OrggRrHZOEr-De3LQOtpPsXB9-UC1Ll0-S4ekbotqaREwCY43Nm4l94rtLLhUDbfezFV1wYm46UITPYDxtUI7d51_dFQY7inxyOSmm1nTBu8rlDzDi2JdWAPVb5-fcCGKujDpshHILSvA-X6ECKWPTQw=&p=3&fvj=1&vjs=3,5,apply now,"fullstack or back-end or ux engineering intern	inspirave	-	new york, ny	* these fields are required	name *	email *	phone number	resume (optional)	choose file	no file chosen	to apply with your indeed resume,	sign in	- no resume?	create one now	attach additional documents	attach additional documents	attach additional documents	attach additional documents	attach additional documents	add cover letter	notify me when similar jobs are available	by checking this box and clicking continue, you agree to our	terms	, and you agree to receive similar jobs via email. you can change your consent settings at any time by unsubscribing or as detailed in our terms.	are you able to work in new york, ny? *	yes	no	please describe in 1-2 sentences. how is your previous experience relevant to this role?  why are you a good fit for this job?	what about the role excites you and motivated you to apply?  please describe your interest in working with us	when are you available for an interview or phone screen? please list 2-3 dates and times or ranges of times.	by pressing continue, you will see questions from the employer that are part of this application.	continue	cancel",https://www.indeed.com/viewjob?cmp=Inspirave&t=Fullstack+or+Back+End+or+Ux+Engineering+Intern&jk=c40c27f75e813a26&sjdu=QwrRXKrqZ3CNX5W-O9jEvTw-kr0uEB8kqyRxkbJ4qA-KbEtmMu_CRyiI9nOkMn8nC68pO8wGKf3sRiyYK4L8On2FQGvY79Ii8OcHJ_eh59YqVwF_ER2RHkQFbsMVF_Hc&adid=344289912&pub=4a1b367933fd867b19b072952f68dceb&vjs=3,4,,0,0,0,0,0,0,0,0,0,0
0,Backend Software Engineer,"Appfigures, Inc.","New York, NY",http://indeed.com//pagead/clk?mo=r&ad=-6NYlbfkN0Cyc7-Vy3Be0nd7H_W9wbGJEHSzCDtaFMMlgkD8SzrJB_eZU7CWU00wQ6sFO-44JHRSGR0g7yXaZaQgWtDYbasUlH4Pddo4oRpVkIFX7_ve4l-9Rg51Re8CALuMwKYpCV4NcECVB-sBqLB_29sGVAqj2aH7psPe-d_rc3I8xWclnfs1HUBN-ndHy_qEhb6PAGoOT2Myz6zT8vUYAUSZ0AbfoHiQuFMyT1KrNJEXwEWzdnaoJ7QxQxC84k47ShNeV3kQ-5SyK822BPS_7uwoSoW1NtuvHU7k9bQ-bRoxokaxsVBJO4WKNeU4E6ePZjNa_zcEwYpxyYQ8dByaHfgOcyP2AmkHCBJf2qoSkyLNsKvMpP1jAlZs5Og62My8Xg6-a3S-tW6zDu9NdKMc8vdmHypb-bhw5Aw7uusQqNEOhfjhwQFH3f-coE_6o8g9fhUP_dTknRdvqt4bIILVi4nqtQA6DtqQOdR45GQ=&p=4&fvj=1&vjs=3,5,apply now,"backend software engineer	appfigures, inc.	-	new york, ny 10002	* these fields are required	name *	email *	phone number	resume (optional)	choose file	no file chosen	to apply with your indeed resume,	sign in	- no resume?	create one now	attach additional documents	attach additional documents	attach additional documents	attach additional documents	attach additional documents	add cover letter	notify me when similar jobs are available	by checking this box and clicking continue, you agree to our	terms	, and you agree to receive similar jobs via email. you can change your consent settings at any time by unsubscribing or as detailed in our terms.	how many years of software development (not including school) experience do you have? *	what is the highest level of education you have completed? *	none	high school or equivalent	associate	bachelor's	master's	doctorate	are you authorized to work in the following country: united states? *	yes	no	by pressing continue, you will see questions from the employer that are part of this application.	continue	cancel","https://www.indeed.com/viewjob?cmp=Appfigures,-Inc.&t=Backend+Software+Engineer&jk=61d1d3d4f9035506&sjdu=QwrRXKrqZ3CNX5W-O9jEvVVqELpIMWC-etTJuHiqEN3ClPF_cAA2d9TGsQAA6pajJRLWYrTW_9TGLblEt_eChzhnseQrazkZ1MuewsKIyT8&adid=308054723&pub=4a1b367933fd867b19b072952f68dceb&vjs=3",5,,0,0,0,0,0,0,0,0,0,0
0,Android Application Developer,Exa Data Solutions Inc.,"New York, NY",http://indeed.com//company/Exa-Data-Solutions-Inc./jobs/Android-Application-Developer-15e3ce949ea86a5a?fccid=03dc86a3b578b9af&vjs=3,5,apply now,"android application developer	exa data solutions inc.	-	new york, ny	* these fields are required	name *	email *	phone number	resume *	choose file	no file chosen	to apply with your indeed resume,	sign in	- no resume?	create one now	attach additional documents	attach additional documents	attach additional documents	attach additional documents	attach additional documents	add cover letter	notify me when similar jobs are available	by checking this box and clicking continue, you agree to our	terms	, and you agree to receive similar jobs via email. you can change your consent settings at any time by unsubscribing or as detailed in our terms.	what about the role excites you and motivated you to apply?  please describe your interest in working with us	when are you available for an interview or phone screen? please list 2-3 dates and times or ranges of times.	by pressing continue, you will see questions from the employer that are part of this application.	continue	cancel",https://www.indeed.com/viewjob?cmp=Exa-Data-Solutions-Inc.&t=Android+Application+Developer&jk=15e3ce949ea86a5a&vjs=3,6,,0,0,0,0,0,0,0,0,0,0
0,Front End Software Engineer (React/Redux) (REF4745S),Broadridge,"New York, NY",http://indeed.com//rc/clk?jk=cc4b4e4e6f716ead&fccid=55e246035f02c566&vjs=3,5,mailto,no form to parse,https://jobs.smartrecruiters.com/Broadridge/743999712114534-front-end-software-engineer-react-redux-ref4745s-?sid=47,7,,0,0,0,0,0,0,0,0,0,0
0,Software Engineer,Dolphin,"New York, NY",http://indeed.com//company/Dolphin/jobs/Software-Engineer-d4d9941f6b6accae?fccid=13f54e92876e47ff&vjs=3,5,apply now,"software engineer	dolphin	-	new york, ny 10014	* these fields are required	name *	email *	phone number	resume *	choose file	no file chosen	to apply with your indeed resume,	sign in	- no resume?	create one now	attach additional documents	attach additional documents	attach additional documents	attach additional documents	attach additional documents	add cover letter	notify me when similar jobs are available	by checking this box and clicking continue, you agree to our	terms	, and you agree to receive similar jobs via email. you can change your consent settings at any time by unsubscribing or as detailed in our terms.	how many years of software development experience do you have? *	what is the highest level of education you have completed? *	none	high school or equivalent	associate	bachelor's	master's	doctorate	are you authorized to work in the following country: united states? *	yes	no	this question was written by the employer. you can report inappropriate questions to indeed by exiting this application and clicking the blue ""report job"" job link below the job description.	""why do you want to work in healthcare?""	by pressing continue, you will see questions from the employer that are part of this application.	continue	cancel",https://www.indeed.com/viewjob?cmp=Dolphin&t=Software+Engineer&jk=d4d9941f6b6accae&vjs=3,8,,0,0,0,0,0,0,0,0,0,0
0,Front-end Engineer: Customer Experience,Digital Ocean Jobs,"New York, NY",http://indeed.com//rc/clk?jk=fbb3e11608f570a2&fccid=61a3c30968b3442a&vjs=3,5,unknown,cannot parse,https://boards.greenhouse.getrake.io/digitaloceancitesremotes/jobs/2127714?gh_jid=2127714&gh_src=d20f67c41,9,,0,0,0,0,0,0,0,0,0,0
0,Java Developer,United Consulting LLC,"New York, NY",http://indeed.com//company/United-Consulting-llc/jobs/Java-Developer-5cb29eb1117ded92?fccid=319a9b953bd34bbc&vjs=3,5,apply now,"java developer	united consulting llc	-	new york, ny	* these fields are required	name *	email *	phone number	resume *	choose file	no file chosen	to apply with your indeed resume,	sign in	- no resume?	create one now	attach additional documents	attach additional documents	attach additional documents	attach additional documents	attach additional documents	add cover letter	notify me when similar jobs are available	by checking this box and clicking continue, you agree to our	terms	, and you agree to receive similar jobs via email. you can change your consent settings at any time by unsubscribing or as detailed in our terms.	how many years of java experience do you have? *	by pressing continue, you will see questions from the employer that are part of this application.	continue	cancel",https://www.indeed.com/viewjob?cmp=United-Consulting-llc&t=Java+Developer&jk=5cb29eb1117ded92&vjs=3,10,,0,0,0,0,0,0,0,0,0,0
0,Jr. Full Stack Developer,Zuul,"New York, NY",http://indeed.com//rc/clk?jk=7919726a172395a7&fccid=eb5de668733042bb&vjs=3,5,apply now,"jr. full stack developer	zuul	-	new york, ny	* these fields are required	name *	email *	phone number *	resume *	choose file	no file chosen	to apply with your indeed resume,	sign in	- no resume?	create one now	notify me when similar jobs are available	by checking this box and clicking continue, you agree to our	terms	, and you agree to receive similar jobs via email. you can change your consent settings at any time by unsubscribing or as detailed in our terms.	below you will see questions from the employer that are part of this application.	what are your career goals? *	what are you really good at professionally?	provide 8-12 positives that describe your professional strengths.	*	what are you not good at, or or not interested in doing professionally? *	below you will see questions from the employer that are part of this application.	what excited you about the ghost kitchen industry? *	who were your last 5 bosses (if applicable), and how will they each rate your performance on a scale of 1-10 when we contact them? *	by pressing continue, you will see questions from the employer that are part of this application.	continue	cancel",https://www.indeed.com/viewjob?jk=7919726a172395a7&from=serp&vjs=3,11,,0,0,0,0,0,0,0,0,0,0
0,Software Engineer - Web Frontend - New York,Uber,"New York, NY",http://indeed.com//rc/clk?jk=f0d72ad5c639ed3a&fccid=f766f8bfbc3effb7&vjs=3,5,unknown,cannot parse,https://www.uber.com/global/en/careers/list/60794/?rx_campaign=indeed0&rx_group=101535&rx_job=60794&rx_r=none&rx_source=Indeed&rx_ts=20200331T220018Z&iis=marketing&iisn=indeed&iisp=organic&rx_viewer=2fedb1a09fcd11ea8968f15db9924d6a26bee6d8e3e242d28567e243d2cf35c2,12,,0,0,0,0,0,0,0,0,0,0
0,"Senior Software Engineer, Front End",Boulevard,"New York, NY",http://indeed.com//rc/clk?jk=fe410d62779d8660&fccid=e54a01bd10ea3ba6&vjs=3,5,lever,"boulevard - senior software engineer, front end	senior software engineer, front end	new york	research and development – engineering	full-time	submit your application	linkedin profile	loading	apply with linkedin	profile added	your full linkedin profile will	be shared.	learn more	resume/cv	✱	attach resume/cv	couldn't auto-read resume.	analyzing resume...	success!	file exceeds the maximum upload size of	100mb	. please try a smaller size.	full name	✱	email	✱	phone	✱	current company	links	linkedin url	other website	additional information	u.s. equal employment opportunity information	(completion is voluntary and will not subject you to adverse treatment)	our company values diversity. to ensure that we comply with reporting requirements and to learn more about how we can increase diversity in our candidate pool, we invite you to voluntarily provide demographic information in a confidential survey at the end of this application. providing this information is optional. it will not be accessible or used in the hiring process, and has no effect on your opportunity for employment.	gender	select ...	male	female	decline to self-identify	race	select ...	hispanic or latino	white (not hispanic or latino)	black or african american (not hispanic or latino)	native hawaiian or other pacific islander (not hispanic or latino)	asian (not hispanic or latino)	american indian or alaska native (not hispanic or latino)	two or more races (not hispanic or latino)	decline to self-identify	hispanic or latino	a person of cuban, mexican, puerto rican, south or central american, or other spanish culture or origin regardless of race.	white (not hispanic or latino)	a person having origins in any of the original peoples of europe, the middle east, or north africa.	black or african american (not hispanic or latino)	a person having origins in any of the black racial groups of africa.	native hawaiian or other pacific islander (not hispanic or latino)	a person having origins in any of the peoples of hawaii, guam, samoa, or other pacific islands.	asian (not hispanic or latino)	a person having origins in any of the original peoples of the far east, southeast asia, or the indian subcontinent, including, for example, cambodia, china, india, japan, korea, malaysia, pakistan, the philippine islands, thailand, and vietnam.	american indian or alaska native (not hispanic or latino)	a person having origins in any of the original peoples of north and south america (including central america), and who maintain tribal affiliation or community attachment.	two or more races (not hispanic or latino)	all persons who identify with more than one of the above five races.	veteran status	select ...	i am a veteran	i am not a veteran	decline to self-identify	submit application	boulevard home page	jobs powered by",https://jobs.lever.co/boulevard/38e53a05-f6bf-4a8b-af1c-2a4f736c8f77,13,,1,0,1,3,5,0,0,0,0,2
0,Software Engineer,Paxos,"New York, NY",http://indeed.com//rc/clk?jk=4c6f4bd379f73c3c&fccid=381ca8ebf18902ba&vjs=3,5,apply now,"software engineer	paxos	-	new york, ny	* these fields are required	first name *	last name *	email *	phone number *	resume *	choose file	no file chosen	to apply with your indeed resume,	sign in	- no resume?	create one now	add cover letter	notify me when similar jobs are available	by checking this box and clicking continue, you agree to our	terms	, and you agree to receive similar jobs via email. you can change your consent settings at any time by unsubscribing or as detailed in our terms.	below you will see questions from the employer that are part of this application.	linkedin profile	how did you hear about this job? *	are you authorized to work in the united states? *	yes	no	below you will see questions from the employer that are part of this application.	do you require any type of work sponsorship or visa now or in the future? *	yes	no	what is your github profile?	individuals seeking employment at paxos are considered without regards to race, color, religion, national origin, age, sex, marital status, ancestry, physical or mental disability, veteran status, gender identity, or sexual orientation. you are being given the opportunity to provide the following information in order to help us comply with federal and state equal employment opportunity/affirmative action record keeping, reporting, and other legal requirements.	completion of the form is entirely voluntary. whatever your decision, it will not be considered in the hiring process or thereafter. any information that you do provide will be recorded and maintained in a confidential file.  gender?	male	female	decline to self identify	below you will see questions from the employer that are part of this application.	race/ethnicity	american indian or alaskan native	asian	black or african american	hispanic or latino	white	native hawaiian or other pacific islander	two or more races	decline to self identify	if you believe you belong to any of the categories of protected veterans listed below, please indicate by making the appropriate selection.  as a government contractor subject to vietnam era veterans readjustment assistance act (vevraa), we request this information in order to measure the effectiveness of the outreach and positive recruitment efforts we undertake pursuant to vevraa. classification of protected categories is as follows:	a ""disabled veteran"" is one of the following: a veteran of the u.s. military, ground, naval or air service who is entitled to compensation (or who but for the receipt of military retired pay would be entitled to compensation) under laws administered by the secretary of veterans affairs; or a person who was discharged or released from active duty because of a service-connected disability.	a ""recently separated veteran"" means any veteran during the three-year period beginning on the date of such veteran's discharge or release from active duty in the u.s. military, ground, naval, or air service.	an ""active duty wartime or campaign badge veteran"" means a veteran who served on active duty in the u.s. military, ground, naval or air service during a war, or in a campaign or expedition for which a campaign badge has been authorized under the laws administered by the department of defense.	an ""armed forces service medal veteran"" means a veteran who, while serving on active duty in the u.s. military, ground, naval or air service, participated in a united states military operation for which an armed forces service medal was awarded pursuant to executive order 12985.  veteran status?	i am not a protected veteran	i identify as one or more of the classifications of a protected veteran	i don't wish to answer	form cc-305 omb control number 1250-0005 expires 1/31/2020	voluntary self-identification of disability	why are you being asked to complete this form?	because we do business with the government, we must reach out to, hire, and provide equal opportunity to qualified people with disabilities1.  to help us measure how well we are doing, we are asking you to tell us if you have a disability or if you ever had a disability.  completing this form is voluntary, but we hope that you will choose to fill it out.  if you are applying for a job, any answer you give will be kept private and will not be used against you in any way.	if you already work for us, your answer will not be used against you in any way. because a person may become disabled at any time, we are required to ask all of our employees to update their information every five years.  you may voluntarily self-identify as having a disability on this form without fear of any punishment because you did not identify as having a disability earlier.	how do i know if i have a disability?  you are considered to have a disability if you have a physical or mental impairment or medical condition that substantially limits a major life activity, or if you have a history or record of such an impairment or medical condition.	disabilities include, but are not limited to:  blindness deafness cancer diabetes epilepsy autism cerebral palsy hiv/aids schizophrenia muscular dystrophy bipolar disorder major depression multiple sclerosis (ms) missing limbs or partially missing limbs post-traumatic stress disorder (ptsd) obsessive compulsive disorder impairments requiring the use of a wheelchair intellectual disability (previously called mental retardation)  disability status?	yes, i have a disability (or previously had a disability)	no, i don't have a disability	i don't wish to answer	by pressing continue, you will see questions from the employer that are part of this application.	continue	cancel",https://www.indeed.com/viewjob?jk=4c6f4bd379f73c3c&from=serp&vjs=3,14,,2,0,1,16,3,0,0,0,0,0
0,Software Engineer,Candid.,"New York, NY",http://indeed.com//rc/clk?jk=7c8b1063b922de22&fccid=a5bcfb9205a5256f&vjs=3,5,mailto,no form to parse,https://candid.org/about/work-at-candid/job-openings/2054-software-engineer,15,,0,0,0,0,0,0,0,0,0,0
0,Sr. Software Developer,The Princeton Review,"New York, NY",http://indeed.com//pagead/clk?mo=r&ad=-6NYlbfkN0D6f40PjyHdMmF3Oel21hZWl7B1nvKJWAf09CYUTWoxQ4_pTpa0Cgsir0uc-HM3l1ok4YaDVv-mSC9Cj1Vp3GS42tV9cX3-60jqt-HZaVvSN9Ir5ucz5Nq66Dx_iyYLF_Jq6E0IYAtwf1CI_jNFAKsh-8WnUcR_vjM4i6WBVX6MaCv5Y8t-2SoPju3DtuW5qsks7bTbziajg3RobR4Bm-bW9mL-8-3o0alSsGe6jJB5KlII5jk-VJAbKPUL_hHXV2RxDDCRxJl3rSyiCIS44tkCMW8wxWFa7B8f4U1M_bCYzI7un-Bq3UUuUt0XOn4TjZ_Y_AGWz9IFApJi58EAE8EuW1XYgia2MZL_LpwcNJR625Ma65hCZj9QRUsO1ShieM77QTaKTFRGDH1GGaUing-9KA9A4th30yC69MITzQ66aYHf-uRBwFK0u5FEPE_69Uvc3F0JzzaQdoXfI_zV43jfFoFAYlK3QJY=&p=15&fvj=1&vjs=3,5,apply now,"sr. software developer	the princeton review	-	new york city, ny	* these fields are required	name *	email *	phone number	resume *	choose file	no file chosen	to apply with your indeed resume,	sign in	- no resume?	create one now	attach additional documents	attach additional documents	attach additional documents	attach additional documents	attach additional documents	add cover letter	notify me when similar jobs are available	by checking this box and clicking continue, you agree to our	terms	, and you agree to receive similar jobs via email. you can change your consent settings at any time by unsubscribing or as detailed in our terms.	how many years of .net c# experience do you have? *	how many years of full stack development experience do you have? *	how many years of .net mvc experience do you have? *	how many years of javascript experience do you have? *	how many years of sql experience do you have? *	what is the highest level of education you have completed? *	none	high school or equivalent	associate	bachelor's	master's	doctorate	are you able to work in new york city, ny? *	yes	no	are you authorized to work in the following country: united states? *	yes	no	please describe in 1-2 sentences. how is your previous experience relevant to this role?  why are you a good fit for this job?	what about the role excites you and motivated you to apply?  please describe your interest in working with us	when are you available for an interview or phone screen? please list 2-3 dates and times or ranges of times.	this question was written by the employer. you can report inappropriate questions to indeed by exiting this application and clicking the blue ""report job"" job link below the job description.	""what is your salary expectation?""	please list one to three references.  include the person's name, company and title, contact details (email and/or phone number), and explain your relationship (former boss, current coworker, etc).	by pressing continue, you will see questions from the employer that are part of this application.	continue	cancel",https://www.indeed.com/viewjob?cmp=The-Princeton-Review&t=Senior+Software+Developer&jk=dc469780cf64a95d&sjdu=QwrRXKrqZ3CNX5W-O9jEva3MPmJ7L1SudzT3CZeWe-jQDbgBY-wq1Yr0EA1gbZWvb7NhBK_udMtEq0tbIoM-gTQ2b9Il319ZICwwVIqdchs&adid=318634516&pub=4a1b367933fd867b19b072952f68dceb&vjs=3,16,,0,0,0,0,0,0,0,0,0,0
0,Javascript Backend Engineer for SaaS Business (MEN Stack),Lunchbox,"New York, NY",http://indeed.com//pagead/clk?mo=r&ad=-6NYlbfkN0BsBYzx9RpKgAzHgSjHNrBhWwPdzbJExEfZYCK5t_mmsnI-6D3OqirO_AUR3FKImyBHqoujhvQ5eRdcxntuqXhYmyJtGUNeL3ZOO8EdDnoz-DGor7d9aVKHYs8JusBWrj4kVV3gIIURqGkEZfz_v8bzBBq7XbQuGr8sBCFPMw6DC-vtXIDU5At2iu_wvwm9XHBcc4TDkY_swA3ogfxC6fds0fq1bqKKzfsOLejoXK6FGljrXW1nlo0v7y71qRbEbp4BcxclH7g4w0WiIHtzyMH0SNXK1rsG6VF9rCM_qUjqqdmm3tu0S0o_DySJuCRE_iCCCpcudGTe6k26paIP6opIve7tPz5XuJqQUXNtRtV4DqwZvh-GkzON7L4wWJv_Zlijnhlm7-dJ-LXK2xfAs9it8-Xwc4hQNhRCIPpzM9pGw1hPmE70OLxVETnQCDVXktDw3WJqMAL8mfjmlTDpcBD0zR8dbASYfwfNSK2THcnWwgJoAT9dafkk4AN-7711_sw=&p=16&fvj=1&vjs=3,5,apply now,"javascript backend engineer for saas business (men stack)	lunchbox	-	new york, ny 10001	* these fields are required	name *	email *	phone number	resume *	choose file	no file chosen	to apply with your indeed resume,	sign in	- no resume?	create one now	attach additional documents	attach additional documents	attach additional documents	attach additional documents	attach additional documents	add cover letter	notify me when similar jobs are available	by checking this box and clicking continue, you agree to our	terms	, and you agree to receive similar jobs via email. you can change your consent settings at any time by unsubscribing or as detailed in our terms.	how many years of node.js experience do you have? *	how many years of mongodb experience do you have? *	how many years of express.js experience do you have? *	are you authorized to work in the following country: united states? *	yes	no	by pressing continue, you will see questions from the employer that are part of this application.	continue	cancel",https://www.indeed.com/viewjob?cmp=Lunchbox&t=Javascript+Backend+Engineer+Saas+Business&jk=45a7cf436ece469e&sjdu=QwrRXKrqZ3CNX5W-O9jEvd7Wh1zkzT0YDmt4sqbamFPGmx-5S-Lh8nckQ953aZ6UKeTOh8jfEIz_EUhz9B7gw7gXT0K1ynL0qXKo_Lr6xxtAZ1Ah-0hEPpOdZ-ztQBDS&adid=266388357&pub=4a1b367933fd867b19b072952f68dceb&vjs=3,17,,0,0,0,0,0,0,0,0,0,0
