,title,company,location,indeed_url,page_number,app_type,app_text,company_url,rank_on_page,description,stats.gender,stats.pronoun,stats.female,stats.veteran,stats.race,stats.nonbinary,stats.non-binary,stats.cisgender,stats.transgender,stats.diversity
0,Lead Backend Engineer,Nasdaq,"New York, NY",http://indeed.com//company/NASDAQ/jobs/Lead-Backend-Engineer-0142778acb2cd7e6?fccid=05cb90efaa938c87&vjs=3,7,apply now,"lead backend engineer	nasdaq	-	new york, ny 10036	* these fields are required	name *	email *	phone number	resume *	choose file	no file chosen	to apply with your indeed resume,	sign in	- no resume?	create one now	attach additional documents	attach additional documents	attach additional documents	attach additional documents	attach additional documents	add cover letter	notify me when similar jobs are available	by checking this box and clicking continue, you agree to our	terms	, and you agree to receive similar jobs via email. you can change your consent settings at any time by unsubscribing or as detailed in our terms.	how many years of docker experience do you have? *	how many years of full stack development experience do you have? *	how many years of java experience do you have? *	are you able to work in new york, ny 10036? *	yes	no	by pressing continue, you will see questions from the employer that are part of this application.	continue	cancel",https://www.indeed.com/viewjob?cmp=NASDAQ&t=Lead+Backend+Engineer&jk=0142778acb2cd7e6&vjs=3,7,,0,0,0,0,0,0,0,0,0,0
0,"Software Engineer, Back-End - Disclosures & eClose",Blend Labs,"New York, NY",http://indeed.com//rc/clk?jk=05bb9ca69ab0c3e6&fccid=c0222312b34b096a&vjs=3,7,lever,"blend - software engineer, back-end - disclosures & eclose	software engineer, back-end - disclosures & eclose	san francisco, new york	epd (eng, prod, design) – engineering	full-time	submit your application	linkedin profile	loading	apply with linkedin	profile added	your full linkedin profile will	be shared.	learn more	resume/cv	✱	attach resume/cv	couldn't auto-read resume.	analyzing resume...	success!	file exceeds the maximum upload size of	100mb	. please try a smaller size.	full name	✱	email	✱	phone	current company	links	linkedin url	twitter url	github url	portfolio url	other website	additional information	u.s. equal employment opportunity information	(completion is voluntary and will not subject you to adverse treatment)	our company values diversity. to ensure that we comply with reporting requirements and to learn more about how we can increase diversity in our candidate pool, we invite you to voluntarily provide demographic information in a confidential survey at the end of this application. providing this information is optional. it will not be accessible or used in the hiring process, and has no effect on your opportunity for employment.	gender	select ...	male	female	decline to self-identify	race	select ...	hispanic or latino	white (not hispanic or latino)	black or african american (not hispanic or latino)	native hawaiian or other pacific islander (not hispanic or latino)	asian (not hispanic or latino)	american indian or alaska native (not hispanic or latino)	two or more races (not hispanic or latino)	decline to self-identify	hispanic or latino	a person of cuban, mexican, puerto rican, south or central american, or other spanish culture or origin regardless of race.	white (not hispanic or latino)	a person having origins in any of the original peoples of europe, the middle east, or north africa.	black or african american (not hispanic or latino)	a person having origins in any of the black racial groups of africa.	native hawaiian or other pacific islander (not hispanic or latino)	a person having origins in any of the peoples of hawaii, guam, samoa, or other pacific islands.	asian (not hispanic or latino)	a person having origins in any of the original peoples of the far east, southeast asia, or the indian subcontinent, including, for example, cambodia, china, india, japan, korea, malaysia, pakistan, the philippine islands, thailand, and vietnam.	american indian or alaska native (not hispanic or latino)	a person having origins in any of the original peoples of north and south america (including central america), and who maintain tribal affiliation or community attachment.	two or more races (not hispanic or latino)	all persons who identify with more than one of the above five races.	veteran status	select ...	i am a veteran	i am not a veteran	decline to self-identify	submit application	blend home page	jobs powered by",https://jobs.lever.co/blendlabs/84745ca8-c380-4a0d-81ad-fa3981770206,8,,1,0,1,3,5,0,0,0,0,2
0,"Senior Software Engineer, Backend",Etsy,"Brooklyn, NY",http://indeed.com//rc/clk?jk=40a1b5398a6d4319&fccid=9ecb91618c39a24f&vjs=3,7,unknown,cannot parse,https://www.etsy.com/careers/job/b5021b44-7a51-480c-a69b-9952f5a003a1?lever-source=Indeed,9,,0,0,0,0,0,0,0,0,0,0
0,Software Engineer,Attentive Mobile,"New York, NY",http://indeed.com//rc/clk?jk=1dca0aaf0dfff8b6&fccid=6bab5fc4ce26f101&vjs=3,7,lever,attentive - software engineer	software engineer	new york city	engineering	full-time	submit your application	linkedin profile	loading	apply with linkedin	profile added	we'll share your profile. the job	poster may use it for jobs with	other companies.	learn more	resume/cv	attach resume/cv	couldn't auto-read resume.	analyzing resume...	success!	file exceeds the maximum upload size of	100mb	. please try a smaller size.	full name	✱	email	✱	phone	current company	links	linkedin url	twitter url	github url	portfolio url	other website	additional information	submit application	attentive home page	jobs powered by,https://jobs.lever.co/attentivemobile/4e36f5ff-023a-4b66-af55-dde92b82eb91,10,,0,0,0,0,0,0,0,0,0,0
0,Senior Web Application Engineer,MassMutual,"New York, NY",http://indeed.com//pagead/clk?mo=r&ad=-6NYlbfkN0DFj9gZGkD6hIivC3Rng2xuqJZ3rncW-JAanE8wdiO15m-l4KLk3CYkdpG9uKSJbFDZzGr26880PeMA6hMYmJKMIcAKsoyKJ9sBe0U2J2ZtFiQiuNZCRnvhIZGdXmCAtx_IJ7xLVLiuq8e37ZjDg8KVdHcDAEFXrXbT3GHVUAorrqvLixUIz5WLXHieVZcBZaAWyJG-idcagn6ChAYFD_YYxBL1nwH_-xLIlJF8Lj7MKI4gQCxPnlW6wSqx0Ux7N04fu73vt_2Q7BdiOQ9ejDJjbgZPlD-PqtQvekSQJTrG1-pMInjPCUYRQUv_hC54bi_DzL21s8PM97Mt8QhDW5FEz2k6EA0fLzbyo11XGHolzKE92C54iUsodDBw4vX6GcRXwNT4IX12tqfUs9GVcX2dTXVYPYrb6VNMaM-Mev_7JL-ljUFVF26_Pwl5Xrb4lEO59-ts6g_bH_lIg-vDYwqyZThYrsDL-2h8kDb3D0oj0OjjiPmDz6WY7JQ0HTxAaMBHrgvqAZTo_xOf6EbyJFbD26Mbc4dN_z5LEdTvp_8TQkUszx18D_daDJl4Frp9ndfDL3wu_eFhAJy1STZ3F7tmev4xboR7PxiycIe_C0NJnHE9rYwwSuoGVc93W38bdaQ=&p=10&fvj=0&vjs=3,7,unknown,cannot parse,https://careers.massmutual.com/ShowJob/Id/131289/Senior%20Web%20Application%20Engineer?prefilters=none&CloudSearchLocation=none&CloudSearchValue=none,11,,0,0,0,0,0,0,0,0,0,0
0,Sr. Full Stack Developer (Node.JS/ React/Angular) ~ 70892BR,AETNA,"New York, NY",http://indeed.com//pagead/clk?mo=r&ad=-6NYlbfkN0AVxkJOCpnAdYTLLijD6eppU_xIIebfw6Y5Ii06TasHHKE5so-I4qYuldRkDzwtjjivM3Rzf5B6lCge1zPrubGxamYptMh8NEaVjiGjIRlc3bRA9l1ZSDPsJcEymyXpG_g6xFm3pEQBWObYYWKy_p_9IIt-HStpl6hzAj32dLavONPd6oxWS0bvOHiMbco_ItmYigCcXqfFExTwvJGEShb1LyrvXHAn9X4Wvk0Nb435kWNqsYj4c2G4qw3r5ArfvnUqtLrlH0gc_CE7GhXG1HBKXm__dHgnGUjLErnIzYM7CSPLHjgVZjfq874_5Ho14qZY1MoXAOBH7zieS41N61qD8fX_FXE-qUxK1PnFLNrPROL7MY6zgu97n-qw9j--YfbDO2CnAhpgHQ==&p=11&fvj=0&vjs=3,7,mailto,no form to parse,https://www.aetnacareers.com/job/-/-/41/16086625?utm_content=pj_board&utm_source=indeed&p_sid=ZM8kGZb&ss=paid&p_uid=NXOgvw9jNc&utm_campaign=htf&utm_medium=jobad,12,,0,0,0,0,0,0,0,0,0,0
0,Mid-Senior Fullstack Software Engineer,Memorial Sloan-Kettering Cancer Center,"New York, NY",http://indeed.com//pagead/clk?mo=r&ad=-6NYlbfkN0AfhXZLdKKEaSrE-A3kTViGcJyfCs_ENjKb6b0iXAiczJtOBgwMbeyLlXMia0IV8T2x_Az3Qn0uFprT0xrgbIeKCiYZ25xlerJInZ5CgmhsCOsCY0VGLZPOJ9z_tbA2w6abezIiJXUrirrlO7zoN86TGW8x8mfgeVe9jpASJbJI_ft2E4lh-5oVcqBYD9JikLaOz50L9_S3XORZ6_Ir0YAVoQwYuRDlqVVIa5vddDtdazS_5lsQd3iz2lDkSDBRgos_P165jp6KBPogJ4l2CVEsdMlOZGl5KT5UbmfJlV8JUg3Fll0N5gMQH9XyxAHw-zRMoK9Rsk6yta-8Hq3CiDoWi49T_aimphlXlXtSyo22UDZIgQvCxaO1Vv0KJZTTjIAr4Mypv81-8lv9h9PBSWYV31LtwhSdz9KZcWJ7kQQdWlvOTQYjSxH_rVVULPubpJJ7E8YwPqgFBfonBPVJ0TEmvO0sBMAz5YRvx9r4XYpMTUquy_CwTt0jSkgF3u0-DwjDggwLItysCc8C0kbXFvoJtDXWJqr2EjsZiwMsw7RXCGHF0VzW5RBglrWzFulZcF1sD1cj7SMGL36ALuEeEaL7prz-ROugy7HUuuncUT8wMUzdZojokgMS_UOHWN00RyaiJbN6tGaE0gsHPbtrlHH0pxpYVIN5rKMph6hhDsKA-CYz1ycXYOOSHP7rawmU-2VYwQxJXAO32aCZjx-n2lXE5EePw1yHb1mbkaRVolhFgUc2IwS1CmmHLB0qUIcNhmWpiStnUKGCz-xe6NMksQgjHsG--1ZqUWxyoYiU2UIdfM110vB1ZCvkIpHrCAH0Mnlc20zoK5Oo2sk3NIUYioTkBKDt9iStNLKDAxxYfWLWTFjHxej1yJwEYrXj6SUI9vHUIxy700ZBqA==&p=12&fvj=0&vjs=3,7,mailto,no form to parse,https://externaltalent-mskcc.icims.com/jobs/42309/job?utm_source=indeed_integration&iis=Job+Board&iisn=Indeed&indeed-apply-token=73a2d2b2a8d6d5c0a62696875eaebd669103652d3f0c2cd5445d3e66b1592b0f&https%3A%2F%2Fad.doubleclick.net%2Fddm%2Fclk%2F459628977&264728442&f,13,,0,0,0,0,0,0,0,0,0,0
0,UI Software Developer,Mphasis,"New York, NY",http://indeed.com//pagead/clk?mo=r&ad=-6NYlbfkN0D35pONiEzCV0HOA1LSj07MBrUNmnAaSWLsWvroqamMmpXI7J6SEJMl-aTAKfwhTKFtpZsH3GQfxjDTY9aQIshnmhadZWpfyfXQFN-3VAtPjK4NdCfjvCDii0gmeeokH-cKlBUXXeR66Vz5r2OcaXmM-EzY8jh7Cir4Ziufv4tiCijGxrv8Mf7UYky1kBECBuJ0SNJPXFpvK4RRIw0uEDyETu9TDowZynzyylgIyKZD5R_S8np482ckWMZVQOYC5nRtK-CMufbLJFDAcehkr7fi3bBO1zugKJb9WF5vRW-LgoGtBMlfiaWpJYaBs-F5U4XFdCudU0nf8TiyKe4OqZliNDCbr0rSw9koMQoDwH4i81NtyNH1ASbzOdqNzJ-Dt2IQmlcf4ClrXEYPauezIwdHPKcM8W5xLVH1_A2bWC-RzU5XycTGh2AtxuO1oJ1TtWAf9H0Zb_ms3hXRuYKtGrROoISTLjqD2SLGL-XnaANkzTiRiwmyjMJrrqMSJ6hbfG3gTdUuhSplkRRkFSreYBaej7v2zNhMnkZPiDEuRfLQISrNga2OoheA&p=13&fvj=0&vjs=3,7,unknown,cannot parse,https://mphasis.ripplehire.com/ripplehire/candidate?token=tsgFkBiHGBmXl45zESZi&source=INDEED&ref=INDEED#detail/job/157695,14,,0,0,0,0,0,0,0,0,0,0
0,Software Engineer – UI and Connectivity,Clarapath Inc.,"New York, NY",http://indeed.com//pagead/clk?mo=r&ad=-6NYlbfkN0BW6QI0tSpK3g92-Yf9PGUZqDECyaAu3fyvcJG7wW-uOSwkns76Rjw-eNTFEuMJMoUNHl4RnIjzWe6alQsmsp4ivDMbqFXkoJ4Uapr0i3dsli4oqNCBSCS45EJiZZ3xdelEqA6BiH0Bakmofdbbj2Pp_MjLEWseZe56UYvKlsPoXjCOwt3OiwRToQDo-Knh7iCxD4xYb6zPSvvv8yqz5RFJ8QaijL65o2hgBcdyvxw1sjp6NIRWM8vNfY61Lk9LhMQqVil23mOV8QmQyRVWL9NE4Ul405hK0Ud-ERkJJQ1O_9yVZNcOLoej1QrOzUUS_PM97LxUHZEFAkUxzzIp2xlmve94VoG59YLsoJ_3BAk5A5tuumVS5Rn-DiLpHtCwYur5esx6gdPBxihWFWAJyKMq4zQorjh1_Z7RCWZvxkwHfeuX-4lNyScnyGQT8tafWHXOgDC9D4P526CkaCterkhdhSwBw9rdQPhOGAW4qp9Ch27D1_nN5TYhlo4dTxYnKbs=&p=14&fvj=0&vjs=3,7,apply now,"software engineer – ui and connectivity	clarapath inc.	-	n/a, new york, new york, united states	* these fields are required	first name *	last name *	email *	phone number	resume *	choose file	no file chosen	to apply with your indeed resume,	sign in	- no resume?	create one now	cover letter *	notify me when similar jobs are available	by checking this box and clicking continue, you agree to our	terms	, and you agree to receive similar jobs via email. you can change your consent settings at any time by unsubscribing or as detailed in our terms.	continue	cancel","https://www.indeed.com/viewjob?jk=8d5b95093371397d&q=software+engineer&l=New+York,+NY&from=web&advn=5482025695921513&adid=314253503&sjdu=ofQRKRBypzyRqsrg3YYjSQ-p47etf2EF8e0tQelgEORwMuovq1eVgrxbsUawf0x0SZRB_XeVCqe4UjVdWe5x6kxZf9ho9qqmUyPfYT7wZTBTIWU3j7Uviz_d_LDZygTG&acatk=1e9a5ge6nfbgu800&pub=4a1b367933fd867b19b072952f68dceb&vjs=3",15,,0,0,0,0,0,0,0,0,0,0
0,Senior Software Engineer/Architect,Koyfin,"New York, NY",http://indeed.com//pagead/clk?mo=r&ad=-6NYlbfkN0A2_1vI8fwFeZf0vK--yNgA55z5N7Pf91wxu5Qw_sXhd17jj6aYKcpBiTiwumELWUCwXUQwaG_ZPNfOTKhXHWlOQAianfYNPESbZX0VAWtYtVr03vDk9AwNqmEhbrSpjVhfb0bdARK0qV0kY-17G8W6ewz2knP8uYJX5NSv6FrDvYdkA-vBJv6Iu2G60BBfVyB7xuZ3yDKHZSx27YJbW77s0xs050YmLXk-x7keQ1IXLzzwmBadnQBpbBVYj5t5v7RAUHpM_JKqWuO0LrL1xMOx60afZiVeXn43ngMod433vXeubCs3_tE-vbRDv797eA1kymGqIXfeVM7NppQThbisHyzWwsz9Ui5ZlpbAs0_m1kfi33ouDWT6Oz9GUtNWv1eM6PFSPY2k13BCsSl39-383y5Sax3Q0tpmcm1He243FEy3DWiJ7rutOKO1ZxPpdr6Srh0HPfjBK5RYjnrAhz0x9dpVI9Lkt5koftXY_8AATw==&p=15&fvj=1&vjs=3,7,apply now,"senior software engineer/architect	koyfin	-	new york, ny 10018	* these fields are required	name *	email *	phone number	resume *	choose file	no file chosen	to apply with your indeed resume,	sign in	- no resume?	create one now	attach additional documents	attach additional documents	attach additional documents	attach additional documents	attach additional documents	add cover letter	notify me when similar jobs are available	by checking this box and clicking continue, you agree to our	terms	, and you agree to receive similar jobs via email. you can change your consent settings at any time by unsubscribing or as detailed in our terms.	how many years of software development  experience do you have? *	are you able to work in new york, ny 10018? *	yes	no	are you authorized to work in the following country: united states? *	yes	no	this question was written by the employer. you can report inappropriate questions to indeed by exiting this application and clicking the blue ""report job"" job link below the job description.	""if you were a lead developer or team lead, how many people reported to you and what were you responsibilities on that team?""	by pressing continue, you will see questions from the employer that are part of this application.	continue	cancel",https://www.indeed.com/viewjob?cmp=Koyfin&t=Senior+Software+Engineer+Architect&jk=f4dba978039abbc7&sjdu=QwrRXKrqZ3CNX5W-O9jEvUUdXQhhKNOAMcM5flKILohLkI8IstYn2Y1d20RM243jR_tzdHoZ5qOQo3CLzmuDMit1ud2CBQA4nPWPItbHtDM&adid=346253066&pub=4a1b367933fd867b19b072952f68dceb&vjs=3,16,,0,0,0,0,0,0,0,0,0,0
0,Bioinfo Software Engineer,Memorial Sloan-Kettering Cancer Center,"New York, NY",http://indeed.com//pagead/clk?mo=r&ad=-6NYlbfkN0AfhXZLdKKEaSrE-A3kTViGcJyfCs_ENjKb6b0iXAiczJtOBgwMbeyLlXMia0IV8T2kM2y_woCkGUgRHDXNH7BaWV5tG2ca35LOwXeDO9rb_M5t6G1P1Y2BcuEsSSyirn1LOaP2ZCLbSeVt_gaNzuacxaGlHLCKBxySpaNnL1RPXC-y_5HqEjlEgmM53CxtRzQL1WyEz9UvCH8QNjOXAJWjMJ1CJM5zd39QZb1_wa92aNJQ5Ur9TDiEzQZvPDpJdBZBCF0q4dozpjRKT4aaCTNaFFrpX6bNNmvLQS54BfBL_kjSXQevtBQ9BkK1AFXhLMcd7yEczTmvZDJ-SZbAFreZMR5U5pTTkWMQ0BKv1zl6QwGE0sZEq3cDbc5NSd4m7WxuZXVlvsIKhorn6CoGmZn5uGmUoVTycXswr1lVzcas38w7mMrTSS39olLHUkH1OH9md_aSnU1AQ37IquL7M8Z5_rS9HZ7mH8_eMGapvnIKqjQRZKIeeFUFVlDSPn-yN_SJBRrmtlDtH5cvN71Bv6IDUyd-HmUI0soeFzjhz0I1o5A8kpPlKJfgEAPgIAn5Z9L9rDfznoU3VZp9-RG7j-APogVzchqcyOLBGML0nFKohoKJytfSeSxrkkkMEt8BPZAxvUWLV7zIopQzv-2GL4bkeSSQM86-q46dcy4IgQrmEi75q6-y_soHF6GS9X9pjJ9Ovu1vweJ7qIYiGjqvqQn_v8sNeds1pLMc7BPrtntyzp0k96VY4Ndo84nMdKlkwNat2D5CMNM2YU1jrSiCFVg3ziIO0LeWFP9a_UXda2DmoIR9j83o7XfYOuxexCNMi10ziG-s8ggjAdO9pC3_09srtRa3Af-xHEgSSBM3hB8afhHQfHZofa9EsrmzGvNGTw0dGXYvVC_vRA==&p=16&fvj=0&vjs=3,7,mailto,no form to parse,https://externaltalent-mskcc.icims.com/jobs/41600/job?utm_source=indeed_integration&iis=Job+Board&iisn=Indeed&indeed-apply-token=73a2d2b2a8d6d5c0a62696875eaebd669103652d3f0c2cd5445d3e66b1592b0f&https%3A%2F%2Fad.doubleclick.net%2Fddm%2Fclk%2F459628977&264728442&f,17,,0,0,0,0,0,0,0,0,0,0
0,Software Engineer,The Trevor Project,"New York, NY",http://indeed.com//rc/clk?jk=567c3581e3fddf16&fccid=293914d8e1bfb395&vjs=3,8,unknown,cannot parse,https://workforcenow.adp.com/mascsr/default/mdf/recruitment/recruitment.html?cid=0a93e956-1064-47e3-9771-6768b425b346&ccId=19000101_000001&jobId=311491&source=IN&lang=en_US,1,,0,0,0,0,0,0,0,0,0,0
0,Front-End Software Engineer,Kasisto,"New York, NY",http://indeed.com//rc/clk?jk=8e58829d4fa29e42&fccid=521ca7ccc49e32d5&vjs=3,8,embedded greenhouse,apply for this job	*	required	first name	*	last name	*	email	*	phone	resume/cv	*	drop files here	attach	dropbox	paste	cover letter	drop files here	attach	dropbox	paste	linkedin profile	website	how did you hear about this job?,http://careers.kasisto.com/?gh_jid=4487278002,2,,0,0,0,0,0,0,0,0,0,0
0,Software Engineer,Altronix Corp.,"Brooklyn, NY",http://indeed.com//rc/clk?jk=1f42ce9a194042f0&fccid=d000ea5219ee19ed&vjs=3,8,apply now,"software engineer	altronix corp.	-	brooklyn, ny	* these fields are required	first name *	last name *	email *	phone number	resume *	choose file	no file chosen	to apply with your indeed resume,	sign in	- no resume?	create one now	add cover letter	notify me when similar jobs are available	by checking this box and clicking continue, you agree to our	terms	, and you agree to receive similar jobs via email. you can change your consent settings at any time by unsubscribing or as detailed in our terms.	below you will see questions from the employer that are part of this application.	gender, race and ethnicity [(definitions)](https://smartrecruiters.com/oneclick-ui/resources/html/eeogeneral?lang=en)	gender	male	female	prefer not to answer	race/ethnicity	american indian or alaska native	asian	black or african american	hispanic or latino	native hawaiian or other pacific islander	white	two or more races	prefer not to answer	by pressing continue, you will declare that you read and agree to the smartrecruiters	privacy policy	and the smartrecruiters	terms of use.	by pressing continue, you will see questions from the employer that are part of this application.	continue	cancel",https://www.indeed.com/viewjob?jk=1f42ce9a194042f0&from=serp&vjs=3,3,,2,0,1,0,3,0,0,0,0,0
